

"Декларация о соответствии, оформленные по единой форме","Декларация о соответствии продукции требованиям технических регламентов Таможенного союза","Индивидуальный предприниматель","Юридическое лицо",Продавец,"Индивидуальный предприниматель Мухторов Дилшод Хамдамалиевич",316554300096516,"
644070, Россия, город Омск, улица Котельникова, дом 8, квартира 26",+79658778741,+79658778741,mukhtorov.dilhod@yandex.ru,Продавец,"Индивидуальный предприниматель Мухторов Дилшод Хамдамалиевич",316554300096516,"
644070, Россия, город Омск, улица Котельникова, дом 8, квартира 26",+79658778741,+79658778741,mukhtorov.dilhod@yandex.ru,"Крестьянское хозяйство ""Жарас""","
Казахстан, Жамбылская область, Шуйский район, село Толе би","Крестьянское хозяйство ""Жарас""","
Казахстан, Жамбылская область, Шуйский район, село Толе би","Протокол испытаний № 885 от 07.09.2016 Испытательного центра агропромышленной продукции почв и агрохимикатов ФГБУ ""Центр агрохимической службы ""Омский"", аттестат аккредитации № РОСС RU.0001.21ПЧ02 от 14.11.2014 бессрочно.
Фитосанитарные сертификаты № 0708\20160831005222279\3, № 0708\20160831005222289\3 от 31.08.2016 Карантинной службы, республики Казахстан.
",2д,"А/М 554 АРА 08 пр 73 АСА 08 , H 520 ЕРМ пр АА 88-47 05
Поставщик : Орманов Б.А.: Улица Т.Бокина, дом 4 , село Толе би, район Шуйский, область Жамбылская, республика Казахстан. 
Условия хранения и сроки годности при температуре хранения 3°С до 20°С и относительной влажности воздуха 75-95%. - 30 суток.


","Протокол испытаний № 885 от 07.09.2016 Испытательного центра агропромышленной продукции почв и агрохимикатов ФГБУ ""Центр агрохимической службы ""Омский"", аттестат аккредитации № РОСС RU.0001.21ПЧ02 от 14.11.2014 бессрочно.
Фитосанитарные сертификаты № 0708\20160831005222279\3, № 0708\20160831005222289\3 от 31.08.2016 Карантинной службы, республики Казахстан.
",2д,"А/М 554 АРА 08 пр 73 АСА 08 , H 520 ЕРМ пр АА 88-47 05
Поставщик : Орманов Б.А.: Улица Т.Бокина, дом 4 , село Толе би, район Шуйский, область Жамбылская, республика Казахстан. 
Условия хранения и сроки годности при температуре хранения 3°С до 20°С и относительной влажности воздуха 75-95%. - 30 суток.


",Партия,Импортная,"Арбузы свежие . Урожай ( Август 2016 г).","Арбузы свежие в транспортной упаковке ( сетки, коробки )",0807,"42 000 кг.","СМР № 0011332 от 31.08.2016, № 0011334 от 31.08.2016. Закупочный акт № б\н от 11.09.2016.","ГОСТ 7177-80 Арбузы продовольственные свежие. Технические условия ","ТР ТС 021/2011 ""О безопасности пищевой продукции""",Партия,Импортная,"Арбузы свежие . Урожай ( Август 2016 г).","Арбузы свежие в транспортной упаковке ( сетки, коробки )",0807,"42 000 кг.","СМР № 0011332 от 31.08.2016, № 0011334 от 31.08.2016. Закупочный акт № б\н от 11.09.2016.","ГОСТ 7177-80 Арбузы продовольственные свежие. Технические условия ","ТР ТС 021/2011 ""О безопасности пищевой продукции""","ТР ТС 022/2011 ""Пищевая продукция в части ее маркировки""","ТР ТС 021/2011 ""О безопасности пищевой продукции""","Орган по сертификации продукции ФГБУ  ""Омский референтный центр Россельхознадзора""",RA.RU.11ПТ55,"Бирюлина Ольга Олеговна","
644031, Омская область, г. Омск, ул. 10-летия Октября, 197","
644031,г. Омск, ул. 10-летия Октября, 197",73812329130,73812329130,"Орган по сертификации продукции ФГБУ  ""Омский референтный центр Россельхознадзора""",RA.RU.11ПТ55,"Бирюлина Ольга Олеговна","
644031, Омская область, г. Омск, ул. 10-летия Октября, 197","
644031,г. Омск, ул. 10-летия Октября, 197",73812329130,73812329130,"ТС N RU Д-KZ.ПТ55.А.02710",12.09.2016,30.09.2016
